57857	Dalcroze Eurhythmics Workshop	None	Music	No course description provided.	Annabelle Joseph<>Stephen Neely	NA	NA	NA	NA
57858	Dalcroze Eurhythmics Workshop	None	Music	No course description provided.	Annabelle Joseph<>Stephen Neely	NA	NA	NA	NA
57859	Dalcroze Eurhythmics Workshop	None	Music	No course description provided.	Stephen Neely	NA	NA	NA	NA
57878	Dalcroze Eurhythmics Workshop	None	Music	No course description provided.	Annabelle Joseph<>Stephen Neely	NA	NA	NA	NA
57879	Dalcroze Eurhythmics Workshop	None	Music	No course description provided.	Annabelle Joseph<>Stephen Neely	NA	NA	NA	NA
57880	Dalcroze Eurhythmics Workshop	None	Music	No course description provided.	Annabelle Joseph<>Stephen Neely	NA	NA	NA	NA
57938	Dalcroze Eurhythmics Workshop	None	Music	None	Stephen Neely	NA	NA	NA	NA
66502	H&SS; Senior Honors Thesis II	9	Dietrich College Interdisciplinary	"This sequence is open only to those seniors who have been admitted to the HSS Senior Honors Program.  This second semester course is the culmination of an original, year-long independent research project.  Research topics are selected by faculty and students."	Instructor TBA	NA	NA	NA	NA
70122	Introduction to Accounting	9	Business Administration	None	Nam Ho	1<>2<>3<>4<>5	1030	1150	POS MN AUD
70208	Regression Analysis	9	Business Administration	None	Erica Vansant	1<>2<>3<>4<>5	900	1020	PH 226B
73100	Principles of Economics	9	Economics	"Literally, an introduction to economic principles, the goal of this course is to give students an understanding as to what constitutes good economic thinking.  This thought process is grounded in the construction and use of economics models.  Drawing on issues in both microeconomics and macroeconomics, fundamental principles are shown to transcend  particular examples and allow the field to be seen as a coherent, unified whole.  (Lecture, 2 hours; Recitation, 1 hour)."	Wenting Yu	1<>2<>3<>4<>5	1330	1450	POS MN AUD
73111	Internship I	None	Economics	By permission of the Undergraduate Economics Program.	Carol Goldburg	NA	NA	NA	NA
73112	Internship II	3	Economics	By permission of the Undergraduate Economics Program.	Carol Goldburg	NA	NA	NA	NA
73113	Internship III	3	Economics	By permission of the Undergraduate Economics Program.	Instructor TBA	NA	NA	NA	NA
73230	Intermediate Microeconomics	9	Economics	None	Leah Clark	1<>2<>3<>4<>5	1030	1150	WEH 4709
73401	Study Abroad Upper Level Economics Elective	None	Economics	This number holds a place for upper level economics elective study abroad transfer credit courses so that these courses can be used in the academic audit system.	Instructor TBA	NA	NA	NA	NA
73402	Study Aboard Upper Level Economics Elective	None	Economics	This number holds a place for upper level economics elective study abroad transfer credit courses so that these courses can be used in the academic audit system.	Carol Goldburg	NA	NA	NA	NA
73403	Study Aboard Upper Level Economics Elective	None	Economics	This number holds a place for upper level economics elective study abroad transfer credit courses so that these courses can be used in the academic audit system.	Carol Goldburg	NA	NA	NA	NA
73404	Study Aboard Upper Level Economics Elective	None	Economics	This number holds a place for upper level economics elective study abroad transfer credit courses so that these courses can be used in the academic audit system.	Carol Goldburg	NA	NA	NA	NA
73495	Advanced Independent Study in Economics	None	Economics	None	Instructor TBA	NA	NA	NA	NA
76101	Interpretation and Argument	9	English	"76-101 introduces first-year students to an advanced, inductive process for writing an argument from sources. Because the course is based upon empirical research about professional academic writers, students will learn expert practices for authoring their own arguments that contribute to an existing community of authors. Because reading and writing are inseparable practices for academic writing, students will read a variety of texts so that they can explore and critically evaluate a single issue from multiple perspectives and from different disciplinary genres. Students will learn methods for summarizing, synthesizing, and analyzing arguments within that issue so that they may contribute an argument of their own.  The course is also geared toward helping students understand the requirements of advanced college-level writing. Our students are typically very accomplished readers and writers, and we are eager to push their accomplishments toward greater excellence. For this purpose, students will build upon their composing knowledge by reflecting and thinking strategically as they plan, write, and revise their own texts. Ultimately, they will develop critical reading, rhetorical and linguistic practices for analyzing and producing texts within the context of an academic community.  Each section of 76-101 is structured by the same objectives and core assignments. There is a core vocabulary and set of heuristics that all sections teach. However, students may find particular issues more appealing than others-we encourage students to pursue their interests, but we also ask that students engage any 76-101 course with intellectual curiosity. Due to the limits of our schedule, we are unable to meet each students individual preferences for course topics, but we do offer a wide variety from which to choose. Section descriptions are posted at: http://www.cmu.edu/hss/english/first_year/index.html"	Jacob Goessling	1<>2<>3<>4<>5	1330	1450	BH A54
76101	Interpretation and Argument	9	English	"76-101 introduces first-year students to an advanced, inductive process for writing an argument from sources. Because the course is based upon empirical research about professional academic writers, students will learn expert practices for authoring their own arguments that contribute to an existing community of authors. Because reading and writing are inseparable practices for academic writing, students will read a variety of texts so that they can explore and critically evaluate a single issue from multiple perspectives and from different disciplinary genres. Students will learn methods for summarizing, synthesizing, and analyzing arguments within that issue so that they may contribute an argument of their own.  The course is also geared toward helping students understand the requirements of advanced college-level writing. Our students are typically very accomplished readers and writers, and we are eager to push their accomplishments toward greater excellence. For this purpose, students will build upon their composing knowledge by reflecting and thinking strategically as they plan, write, and revise their own texts. Ultimately, they will develop critical reading, rhetorical and linguistic practices for analyzing and producing texts within the context of an academic community.  Each section of 76-101 is structured by the same objectives and core assignments. There is a core vocabulary and set of heuristics that all sections teach. However, students may find particular issues more appealing than others-we encourage students to pursue their interests, but we also ask that students engage any 76-101 course with intellectual curiosity. Due to the limits of our schedule, we are unable to meet each students individual preferences for course topics, but we do offer a wide variety from which to choose. Section descriptions are posted at: http://www.cmu.edu/hss/english/first_year/index.html"	Craig Stamm	1<>2<>3<>4<>5	1500	1620	BH A54
76226	"Film and Literature: Mystery, Sexuality, and Culture in American Film"	9	English	None	Bret Vukoder	2<>4	1830	2120	SH 208
76270	Writing for the Professions	9	English	"Writing in the Professions is a writing course specifically designed for juniors and seniors in all majors other than English. The course is appropriate for upper-level students in all CMU colleges, has no writing prerequisites, and assumes that you may not have had much college-level writing instruction past your freshman year. The basic idea of the course is to give you experience in developing the writing skills you will be expected to have as you make the transition from student to professional. The course will cover resume writing, proposal writing, writing instructions, the difference between writing for general and specific audiences, and analysis of visual aids in various texts. The course requires that students work both independently and in groups."	Daniel Dickson-Laprade	1<>2<>3<>4<>5	1030	1150	PH 226A
76301	Internship	None	English	"This course is designed to help you explore possible writing-related careers as you gain workplace experience and earn academic credit. Youll work on- or off-campus as an entry-level professional writer for 8-10 hours per week in a field of interest to you (public relations, journalism, advertising, magazine writing, non-profit, healthcare, etc.). You are responsible for finding an internship. Most of your class time for the course will be completed at your internship site - a minimum of 120 hours (8-10 per week) over the semester for 9 units of credit. As the academic component of the course, youll keep a reflective journal and meet periodically with the internship coordinator to discuss your internship and related professional issues. You must register for the course before the add/drop deadline of the semester in which you want to do your internship. Before you can register, you must contact the internship instructor listed above to express your interest in the course and to be cleared for registration. Credit for the internship course cannot be retroactively awarded for past internships."	James Wynn	NA	NA	NA	NA
79201	Introduction to Anthropology	9	History	None	Shawn Alfonso-Wells	1<>2<>3<>4<>5	1030	1150	PH A18A
79392	History of Modern Warfare	9	History	None	Vagel Keller	1<>2<>3<>4<>5	1200	120	PH 226A
79491	Independent Study	None	History	An Independent Study is meant for students with a special interest in an area not covered by a formal history course.  Readings and other work are negotiated between the student and an individual faculty member.	Instructor TBA	NA	NA	NA	NA
80100	Introduction to Philosophy	9	Philosophy	"In this introductory course we will explore three major areas of Philosophy: Ethics, Metaphysics, and Epistemology. Accordingly the course is divided into three sections. In each section we will read primary sources and discuss some of the main philosophic problems associated with that area. These will include: moral problems (Ethics), problems rising from the debates about free-will, personal identity or intelligence (Metaphysics), and inquiries about the scope and limits of human knowledge (Epistemology). We will then introduce some theories designed to solve such problems, and try to understand the strengths and weaknesses of these theories. We will apply different techniques and theories to issues that we might encounter in the real world. We will use class discussions, homeworks and papers to learn skills for evaluating arguments. These skills include: how to present a philosophic argument, what are the assumptions that justify it, what are its weaknesses and its strengths, whether such weaknesses can be resolved and, if they cannot be resolved, why."	Aeyaz Kayani	1<>2<>3<>4<>5	1200	120	BH 150
80130	Introduction to Ethics	9	Philosophy	None	Jacob Steen	1<>2<>3<>4<>5	1200	120	DH 4303
80205	Introduction to Rational Choice	9	Philosophy	None	Joseph McCool	1<>2<>3<>4<>5	1330	1450	DH 4303
80212	Arguments and Logical Analysis	9	Philosophy	None	Patrick Walsh	1<>2<>3<>4<>5	1030	1150	BH 150
80241	Ethical Judgments in Professional Life	9	Philosophy	None	Aidan Kestigian	1<>2<>3<>4<>5	1500	1620	BH 150
80495	Independent Study	None	Philosophy	Independent Study	Instructor TBA	NA	NA	NA	NA
82102	Elementary French II	12	Modern Languages	"This course is designed for students who have taken first-semester French at Carnegie Mellon or learned its equivalent as determined by placement. Using a proficiency-oriented approach, students will expand contextually appropriate interpersonal communication skills in both written and spoken French, continue to develop reading and listening skills through the use of various media, review previously learned and practice new grammar and vocabulary, and gain a further understanding of French and francophone cultures through class activities. Regular homework, quizzes, tests, presentations, and class participation are mandatory (four in-class hours per week). The elementary level is also designed to help students learn to reflect and draw upon strategies used by good language learners in their second language study. A student with prior experience in French must take the placement exam."	Michael West	1<>2<>3<>4<>5	1200	120	WEH 4623
82111	Elementary Arabic I	12	Modern Languages	"This course is for students with no prior experience in Arabic. Using a proficiency-oriented approach, students will develop contextually appropriate interpersonal communication skills in both written and spoken Arabic, develop reading and listening skills through the use of various media, understand fundamental grammar, acquire vocabulary, and gain a basic understanding of Arab cultures through class activities. Students will primarily learn Modern Standard Arabic for reading, writing, listening, and speaking, with a minor focus on learning the Egyptian and Levantine dialects for listening and speaking. The elementary level is also designed to help students learn to reflect and draw upon strategies used by good language learners in their second language study. Regular homework, quizzes, tests, presentations, and class participation are mandatory (four in-class hours per week). A student with prior experience in Arabic must be placed into the appropriate course by visiting Baker Hall 160. Prerequisite: None"	Instructor TBA	1<>2<>3<>4<>5	900	1020	SH 222
82112	Elementary Arabic II	12	Modern Languages	None	Instructor TBA	NA	NA	NA	NA
82114	Arabic for Global Exchange Online	6	Modern Languages	"Arabic for Global Exchange is a course in Arabic language and culture that utilizes cognitive learning technologies and computer-assisted language instruction to enhance educational, governmental, and business exchanges that are increasingly vital to public policy and economic development in the global economy. This is a mini-course for individuals with no proficiency or extremely limited knowledge of Arabic language and culture who are about to begin study or work in an Arabic-speaking context. The course introduces learners to basic concepts and information to facilitate entry and engagement in an Arabic-speaking environment. The Arabic for Global Exchange project aims to meet a need for high quality, communication-oriented instructional materials to introduce basic cultural knowledge and survival language. Arabic for Global Exchange is a six-week, six-lesson, half-semester course (equivalent of six weeks of university-level instruction), or roughly sixty hours of student effort. Each of the six lessons in the course includes texts and activities to promote acquisition of cultural content in English as well as basic introductory exposure to the Arabic language.  Prerequisite: None"	Nevine Abraham	2	900	1020	BH A54
82115	Beginning Arabic for Oral Communication	6	Modern Languages	"Beginning Arabic for Oral Communication is designed for students who have either taken Arabic for Global Exchange or desire to learn how to orally communicate in Arabic. This course does not teach how to read or write Arabic. It offers students the opportunity to engage in conversation that expands on the linguistic topics offered in Arabic for Global Exchange, using a spoken Arabic that would be widely understood anywhere in the Arab World. The conversation topics include greetings, explaining ones background, formal and informal meetings, eating out and ordering food, shopping and bargaining, using transportation, expressing feelings and opinions, describing things, people, and hobbies, and in addition, students will learn common expressions and their uses."	Nevine Abraham	2	1030	1150	BH A54
82131	Elementary Chinese I	12	Modern Languages	"This course is for students with no prior experience in Chinese. Using a proficiency-oriented approach, students will develop contextually appropriate interpersonal communication skills in both written and spoken Chinese, develop reading and listening skills through various media, understand fundamental grammar, acquire vocabulary, and gain a basic understanding of Chinese cultures through class and extracurricular activities. Regular homework, quizzes, tests, and participation in class are mandatory (four in-class hours per week). Students will learn the phonetic transcriptions of Chinese (Pinyin) for speaking and listening as well as Chinese characters for reading and writing. The elementary level is also designed to help students learn to reflect and draw upon strategies used by good language learners in their second language study. A student with prior experience in Chinese must take the placement exam."	Gang Liu	1<>2<>3<>4<>5	1030	1150	SH 222
82132	Elementary Chinese II	12	Modern Languages	"This course is designed for students who have taken first-semester Chinese at Carnegie Mellon or its equivalent by placement. Students will continue developing contextually appropriate interpersonal communication skills in both written and spoken Chinese, developing reading and listening skills through various media, and working toward a deeper understanding of Chinese culture. Work for this course will include the introduction and use of more complicated sentence structures, grammar, and expressions. Students are also encouraged to communicate in longer sentences and write short paragraphs and essays in Chinese. Regular homework, quizzes, tests, and participation in class are mandatory (four in-class hours per week). Students will continue to learn the phonetic transcriptions of Chinese (Pinyin) for speaking and listening as well as Chinese characters for reading and writing. The elementary level is designed to help students learn to reflect and draw upon strategies used by good language learners in their second language study. A student with prior experience in Chinese must take the placement exam."	Gang Liu	1<>2<>3<>4<>5	1200	120	BH 154A
82133	Elementary Chinese Online I	12	Modern Languages	"This course is designed for students who need a more flexible approach to language learning than that offered in a standard classroom course. It is designed to help beginners develop communicative competence in the four basic skills of listening, speaking, reading and writing the Chinese language. Basic vocabulary and sentence structures for use in essential daily-life situations, as well as cultural information, are taught through the course materials and assignments. Materials are web-based with extensive use of Internet technologies for listening, reading, and communication. This course is offered in a hybrid mode requiring one 80-minute class per week in addition to weekly 20-minute individual meetings with the instructor or a peer speaking assistant. There is a materials fee for taking this course which is paid by credit card on first log-in to the course website. Students in this class should be prepared to participate in such studies in the course of their classwork. A student with prior experience in Chinese must take the placement exam. Instructions for the placement exam are available in Baker Hall 160.  Prerequisite: None"	Sue-Mei Wu	NA	NA	NA	NA
82134	Elementary Chinese Online II	12	Modern Languages	"This course is the continuation of 82-133, Elementary Chinese I Online. Students will continue learning more useful and complex expressions and sentence structures necessary for use in everyday life. Students will also continue building their skills in listening, speaking, reading, and writing for everyday communication, and their understanding of Chinese culture and society. This course is offered in a hybrid mode requiring one 80-minute class per week in addition to weekly 20-minute individual meetings with the instructor or a peer speaking  assistant. There is a materials fee for taking this course which is paid by credit card on first log-in to the course website. A student with prior experience in Chinese must take the placement exam. Instructions for the placement exam are available in Baker Hall 160. Prerequisite: 82-131 or 82-133 or placement"	Sue-Mei Wu	NA	NA	NA	NA
82162	Elementary Italian II	12	Modern Languages	None	Giovanni Puppo	1<>2<>3<>5	1530	1720	BH 154A
82171	Elementary Japanese I	12	Modern Languages	"This course is the first part of a two-semester course sequence (82-171, 82-172) for students with no prior experience in Japanese. It emphasizes the development of communicative language proficiency through oral practice, aural comprehension, reading, writing, and the study of cultural aspects of Japanese society. Regular homework, quizzes, tests, presentations, and class participation are mandatory (four in-class hours per week). The elementary level is also designed to help students learn to reflect and draw upon strategies used by good language learners in their second language study. A student with prior experience in Japanese must take the placement exam."	Chisato Ninomiya	1<>2<>3<>4<>5	1630	1750	PH 226C
82172	Elementary Japanese II	12	Modern Languages	"This course is a sequel to Elementary Japanese I (82-171) and continues to further the development of communicative language proficiency through oral practice, aural comprehension, reading, writing, and the study of cultural aspects of Japanese society. Regular homework, quizzes, tests, presentations, and class participation are mandatory (four in-class hours per week). The elementary level is also designed to help students learn to reflect and draw upon strategies used by good language learners in their second language study. A student with prior experience in Japanese must take the placement exam."	Fang-Chi Scheide	1<>2<>3<>4<>5	900	1020	BH 154A
82208	Topics in European Studies	9	Modern Languages	"European Society and Culture Between and After the Two Great Wars of the 20th Century.   How did World War I and World War II change European society and culture? Defining the meaning of Europe or European is complicated, since it refers to both a geographical location and a shared history and cultural identity. Based on an interdisciplinary approach to the multiple regions and countries located on a single continent, the course will equip students with the skills, methods, and concepts essential for a better understanding of European culture, society and thought.  It will focus particularly on such tragic events as World War I and World War II, and the rise and fall of Nazi and Communist regimes and ideologies. Students will learn how to present material effectively, to analyze texts critically and to construct coherent arguments."	Naum Kats	1<>2<>3<>4<>5	1330	1450	PH 226A
82212	Intermediate Arabic II	12	Modern Languages	None	Instructor TBA	NA	NA	NA	NA
82231	Intermediate Chinese I	12	Modern Languages	"This course is the continuation of Elementary Chinese II (82-132). At the intermediate level, students will continue to improve the basic skills of listening, speaking, reading and writing with the goal of becoming more proficient in daily communication needs. In addition to an ongoing review of basic grammar, a greater variety of expressions and complicated sentence structures will be taught so that students can carry on more sophisticated daily conversations on various topics related to every day life. While equal emphasis will still be on both Pinyin and characters, students will be encouraged to use more and more Chinese characters with the help of Pinyin for communication. In-class and extracurricular activities related to the broad spectrum of Chinese culture will be organized to facilitate language learning using knowledge of the cultural background of the language. Regular homework, quizzes, tests, presentations, essays, and class participation are mandatory (four in-class hours per week). A student with prior experience in Chinese must take the placement exam."	Qiong Li	1<>2<>3<>4<>5	1030	1150	SH 212
82232	Intermediate Chinese II	12	Modern Languages	"This is the second semester of Intermediate Chinese. Its primary goals are to expand students vocabulary and knowledge of grammar of the Chinese language by learning more new words, expressions, and sentence patterns needed for everyday communication and by consolidating their knowledge through oral and written practice in and out of class. In this course, students will participate in classroom discussions in Mandarin Chinese on various topics concerning everyday life and write short paragraphs on those topics using Chinese characters. Different aspects of Chinese culture will also be introduced during the whole semester through multimedia, lectures, and discussions. Regular homework, quizzes, tests, presentations, and class participation are mandatory (four in-class hours per week). A student with prior experience in Chinese must take the placement exam."	Qiong Li	1<>2<>3<>4<>5	1200	120	SH 212
