82272	Intermediate Japanese II	12	Modern Languages	"This course is a sequel to Intermediate Japanese I (82-27182-171). At the intermediate level, students will continue to improve the basic skills of listening, speaking, reading and writing skills with the goal of becoming more proficient in daily communication needs, and takes an integrated approach to the study of Japanese language and culture, consisting of grammar review, reading, and intensive practice in written and spoken Japanese. Course materials include authentic audiovisual and written texts in addition to the assigned textbooks. Also integrated are cultural explorations through direct interactions with native speakers. Regular homework, quizzes, tests, presentations, essays, and class participation are mandatory (four in-class hours per week). A student with prior experience in Japanese must take the placement exam. Prerequisite: 82-271 or placement"	Fang-Chi Scheide	1<>2<>3<>4<>5	1030	1150	BH 154A
82273	Introduction to Japanese Language and Culture	9	Modern Languages	"This course is an introduction to modern Japanese. Given the close link between the Japanese language and culture, the examination of the distinctive characteristics of the Japanese language and its sociocultural context provides important insights into contemporary Japan. This course is taught in English and is intended both for individuals who want to gain a better understanding of modern Japanese society, as well as for students of the Japanese language."	Yasufumi Iwasaki	1<>2<>3<>4<>5	1500	1620	PH 226A
82288	Introduction to Haitian Studies	9	Modern Languages	None	Instructor TBA	1<>2<>3<>4<>5	1330	1450	PH 226B
82332	Advanced Chinese II	9	Modern Languages	"A continuation of Advanced Chinese I, this course is designed to improve students proficiency to function with Chinese in situations beyond their everyday life. Students will continue to learn more complex language phenomena in order to use exposition, explanation, description, and argumentation in Chinese. More sophisticated language phenomena will be introduced to students together with their social and cultural background through texts and multimedia related to various social issues in China today, for example, traffic, education, employment, healthy living, and other human relations as well as economic situations. Classroom discussion and research project presentations will be the major forms of oral practice, and writing practice will mainly focus on essays and group research project papers. Prerequisite: 82-331 or placement"	Gang Liu	1<>2<>3<>4<>5	1330	1450	BH 154A
82371	Advanced Japanese I	9	Modern Languages	"This course emphasizes the acquisition of advanced level of communicative language proficiency by immersing students in authentic cultural explorations. The curriculum includes authentic reading texts, multimedia, interviews with native speakers, and viewing and summarizing Japanese films that depict current Japanese society and cultural trends. The course also provides an individualized learning environment throughout the term in improving students language skills and cultural proficiency. Students may pick a topic of personal interest for their term project thesis. A student with prior experience in Japanese must take the placement exam."	Yasufumi Iwasaki	1<>2<>3<>4<>5	1030	1150	SH 208
82372	Advanced Japanese II	9	Modern Languages	"This course continues to further improve the acquisition of advanced level communicative language proficiency by immersing students in authentic cultural explorations. The curriculum includes authentic reading texts, multimedia, interviews with native speakers, and viewing and summarizing Japanese films that depict current Japanese society and cultural trends. The course also provides an individualized learning environment throughout the term in improving students language skills and cultural proficiency. Students may pick a topic of personal interest for their term project thesis. A student with prior experience in Japanese must take the placement exam."	Yasufumi Iwasaki	1<>2<>3<>4<>5	1200	120	PH 226B
82440	Studies in Chinese Literature & Culture	9	Modern Languages	None	Sue-Mei Wu	NA	NA	NA	NA
85102	Introduction to Psychology	9	Psychology	None	Chante Boyd	1<>2<>3<>4<>5	1200	120	GHC 4211
85241	Social Psychology	9	Psychology	None	Chante Boyd	1<>2<>3<>4<>5	1330	1450	GHC 4211
85482	Internship in Psychology	None	Psychology	"The Internship in Psychology is designed to enable students to gain experience in professional settings related to their studies in Psychology and earn credit for the intellectual work involved.  It is the students responsibility to locate an internship site and on-site supervisor, as well as to identify a CMU faculty sponsor. The student registers for the internship by submitting a completed internship form to Theresa Kurutz in Baker Hall 343."	Erik Thiessen	NA	NA	NA	NA
85505	Readings In Psychology	None	Psychology	"As the name implies, the emphasis in the Reading course is on reading articles and books in some specified area. The students work in the course must lead to the production of a written paper which will be read by the instructor directing the readings. Often the reading is related to a research project which the student may wish to conduct. Readings courses have also been used to give students an opportunity to receive instruction in areas which are not included elsewhere in our course listing.  The course may be taken for any number of units up to 9, depending upon the amount of work to be done."	Instructor TBA	NA	NA	NA	NA
85781	Graduate Reading and Research	None	Psychology	None	Instructor TBA	NA	NA	NA	NA
86700	Reading and Research in Computational Neuroscience	None	Center for the Neural Basis of Cognition	None	Instructor TBA	NA	NA	NA	NA
88398	Independent Study	None	Social & Decision Sciences	"Students conduct independent academic study under the supervision of a Social  Decision Sciences faculty member. Students who wish to engage in an independent study should seek out a faculty member whose interests are appropriate to the topic. Students must also complete an Independent Study/Research for Credit form, available from the SDS Coordinator of Student Programs in Porter 208A.  Prerequisite: Permission of a faculty sponsor."	Paul Fischbeck	NA	NA	NA	NA
88398	Independent Study	None	Social & Decision Sciences	"Students conduct independent academic study under the supervision of a Social  Decision Sciences faculty member. Students who wish to engage in an independent study should seek out a faculty member whose interests are appropriate to the topic. Students must also complete an Independent Study/Research for Credit form, available from the SDS Coordinator of Student Programs in Porter 208A.  Prerequisite: Permission of a faculty sponsor."	Instructor TBA	NA	NA	NA	NA
88398	Independent Study	None	Social & Decision Sciences	"Students conduct independent academic study under the supervision of a Social  Decision Sciences faculty member. Students who wish to engage in an independent study should seek out a faculty member whose interests are appropriate to the topic. Students must also complete an Independent Study/Research for Credit form, available from the SDS Coordinator of Student Programs in Porter 208A.  Prerequisite: Permission of a faculty sponsor."	Julie Downs	NA	NA	NA	NA
88505	Undergraduate Internship	None	Social & Decision Sciences	"An internship is an approved and monitored work experience than can be related to an academic field of study through active reflection and specific learning goals.  Students must work at least 10 hours per week for the semester at the internship.  Additionally, students will also keep in regular contact with a faculty member in Social and Decision Sciences, who will assign and evaluate academic work.  Internships are available for 3, 6, or 9 units, depending on the type and amount of academic work produced. Students are responsible for finding their own internships and faculty sponsors, although assistance is available in the department."	Instructor TBA	NA	NA	NA	NA
90500	Quantitative Fundamentals	9	Public Policy & Mgt:Sch of Pub Pol & Mgt	None	Hilary Wolfendale<>Thomas Goldring	1<>2<>3<>4<>5	900	1150	HBH 1001
90500	Quantitative Fundamentals	9	Public Policy & Mgt:Sch of Pub Pol & Mgt	None	Hilary Wolfendale<>Thomas Goldring	1<>2<>3<>4<>5	900	1150	HBH 1003
99099	Carnegie Mellon University Summer Program	6	Carnegie Mellon University-Wide Studies	None	Instructor TBA	NA	NA	NA	NA
99239	Introduction to Nanoscience and Technology	9	Carnegie Mellon University-Wide Studies	None	Michael Bockstaller	1<>3<>5	1300	1450	SH 214
