03121	Modern Biology	9	Biological Sciences	None	Daniel Brasier	1<>2<>3<>4<>5	1530	1650	WEH 5302
03124	Modern Biology Laboratory	9	Biological Sciences	None	Carrie Doonan	1<>3	1200	1250	MI 355
03132	Basic Science to Modern Medicine	9	Biological Sciences	"This course will focus on the genetics, cell biology, and developmental biology behind human biology and human disease, as well as the growing opportunities for novel therapeutic options that basic science delivers.  This is a topics based course, with topics chosen to cover aspects of human biology and health that students are likely to encounter in their daily lives such as cancer, stem cells, genome sequencing, and the human microbiota. Students will explore these topics from both a basic science and a human health perspective."	Brooke Mccartney	1<>2<>3<>4<>5	1500	1620	BH 140F
03161	Molecules to Mind	9	Biological Sciences	"This course provides a depth-first approach to understanding neuroscience.  We will begin with a clinical focus on neuroanatomy, introducing students to some basic neurological diagnostic techniques. We will then explore the biological basis of neuronal function and link the function of individual neurons to a broader context of neural systems.  This will be done in the context of primary literature.  Students who complete this course will therefore have an understanding of research methods and be prepared to evaluate scientific literature.  The course will have a strong focus on the biological and cellular basis of neuronal excitability and also give students significant, in depth exposure to the function of synapses and their plasticity.  Finally, the course will give students an in depth look at sensory and/or motor systems by focusing on one system in particular, rather than providing a broad overview of many different sensory and motor systems."	Daniel Brasier	1<>2<>3<>4<>5	900	1020	WEH 5302
03210	Independent Study	None	Biological Sciences	"Students will read papers from the original literature under the direction of a faculty member. Students will be required to demonstrate mastery of the readings by discussions with the sponsoring faculty member, oral presentations, or writing of one or more papers summarizing and extending the information in the readings. If appropriate, students may write a program(s) to satisfy this last requirement. A student may take this course only once.  This is a mini format course.  Special permission required."	Mary Braun	NA	NA	NA	NA
03445	Undergraduate Research	None	Biological Sciences	Students may investigate research problems under the supervision of members of the faculty. Permission of a faculty advisor required.	Becki Campanaro	NA	NA	NA	NA
08997	Societal Computing Graduate Reading and Research	None	Institute for Software Research	Societal Computing PhD Students only sign up for Reading  Research.  Please make sure you sign up under your advisers section	James Herbsleb	NA	NA	NA	NA
09001	Chemistry Elective	None	Chemistry	None	Karen Stump	NA	NA	NA	NA
09050	Study Abroad	0	Chemistry	Missing Course Description - please contact the teaching department.	Instructor TBA	NA	NA	NA	NA
09101	Introduction to Experimental Chemistry	3	Chemistry	None	Carolyn Neiderlander	1	1330	1420	DH 2302
09105	Introduction to Modern Chemistry I	10	Chemistry	"This course begins with a very brief survey of some fundamental principles of chemistry and a presentation of chemically interesting applications and sophisticated problems. These will form the basis for introducing the relationships between the structure of molecules and their chemical properties and behavior. The subject matter will include principles of atomic structure, chemical bonding, intermolecular interactions and molecular structures of organic and inorganic compounds including some transition metal complexes. Relevant examples will be drawn from such areas as environmental, materials, and biological chemistry. 3 hrs. lec, 2 hrs. rec."	Charles Henderson	1<>2<>3<>4<>5	900	1020	DH 2302
09218	Organic Chemistry II	9	Chemistry	None	Rong Cao	1<>3<>5	1030	2450	DH 2302
09435	Independent Study Chemistry	None	Chemistry	The course allows students to earn academic credit for concentrated study in a topic area developed in conjunction with and monitored by a faculty member in the Department of Chemistry.  These topics are distinct from projects that would rise to the level of undergraduate research either because they are in unrelated areas distinct from the faculty members research interests or may constitute the investigation and compilation of existing information from a variety of resources and may not be expected to result in the generation of new information as is a reasonable expected outcome in undergraduate research (likely is not publishable).	Karen Stump	NA	NA	NA	NA
09445	Undergraduate Research	None	Chemistry	"Properly qualified students may undertake research projects under the direction of members of the faculty, normally 6 to 12 hrs/week. A written, detailed report describing the project and results is required. Course may be taken only with the consent of a faculty research advisor in chemistry or on occasion in another department provided that the project is chemical in nature and with permission of the Director of Undergraduate Studies. The number of units taken generally corresponds to the actual number of hours the student actually spends in the lab doing research during the week. Maximum number of units taken per semester is 18."	Karen Stump	NA	NA	NA	NA
09861	Chemical Research	None	Chemistry	None	Rebecca Freeland	NA	NA	NA	NA
09871	Doctoral Dissertation	5	Chemistry	None	Rebecca Freeland	NA	NA	NA	NA
09990	TBA	None	Chemistry	None	Rebecca Freeland	NA	NA	NA	NA
12993	Reading and Research in Civil and Environmental Engineering	None	Civil & Environmental Engineering	This reading and research course is designed for CEE research assistants (PhD and MS RAs) to reflect activity related to their research during the Summer semester.	Instructor TBA	NA	NA	NA	NA
12993	Reading and Research in Civil and Environmental Engineering	None	Civil & Environmental Engineering	This reading and research course is designed for CEE research assistants (PhD and MS RAs) to reflect activity related to their research during the Summer semester.	Instructor TBA	NA	NA	NA	NA
15110	Principles of Computing	10	Computer Science	None	Norman Bier	1<>2<>3<>4<>5	900	1020	GHC 4215
15122	Principles of Imperative Computation	10	Computer Science	"For students with a basic understanding of programming (variables, expressions, loops, arrays, functions). Teaches imperative programming and methods for ensuring the correctness of programs.  Students will learn the process and concepts needed to go from high-level descriptions of algorithms to correct imperative implementations, with specific application to basic data structures and algorithms.  Much of the course will be conducted in a subset of C amenable to verification, with a transition to full C near the end. This course prepares students for 15-213 and 15-210.  NOTE: students must achieve a C or better in order to use  this course to satisfy the pre-requisite for any subsequent Computer  Science course."	Victor Adamchik	1<>2<>3<>4<>5	1030	1150	GHC 4307
17997	Graduate Reading and Research	None	Software Engineering	Graduate Reading and Research for Software Engineering PhD Students.  Only Software Engineering PhD students should register for this course	Jonathan Aldrich	NA	NA	NA	NA
18331	Junior Projects	None	Electrical & Computer Engineering	"The Department of Electrical and Computer Engineering at Carnegie Mellon   considers experiential learning opportunities important educational   options for its undergraduate students.  One such option is conducting   undergraduate research with a faculty member.  Students do not need to   officially register for undergraduate research unless they want it   listed on their official transcripts.  An ECE student who is involved in   a research project and is interested in registering this undergraduate   research for course credit on the official transcript may request to be   enrolled in this course.  To do this, the student should first complete   the on-line undergraduate research form available on the ECE   undergraduate student page.  Once the form has been submitted and   approved by the faculty member the student is conducting the research   with, the ECE Undergraduate Office will add the course to the students   schedule.  Typical credit is granted as one hour of research per week is   equal to one unit of credit."	Diana Marculescu	NA	NA	NA	NA
18432	Senior Projects	None	Electrical & Computer Engineering	"The Department of Electrical and Computer Engineering at Carnegie Mellon   considers experiential learning opportunities important educational   options for its undergraduate students.  One such option is conducting   undergraduate research with a faculty member.  Students do not need to   officially register for undergraduate research unless they want it   listed on their official transcripts.  An ECE student who is involved in   a research project and is interested in registering this undergraduate   research for course credit on the official transcript may request to be   enrolled in this course.  To do this, the student should first complete   the on-line undergraduate research form available on the ECE   undergraduate student page.  Once the form has been submitted and   approved by the faculty member the student is conducting the research   with, the ECE Undergraduate Office will add the course to the students   schedule.  Typical credit is granted as one hour of research per week is   equal to one unit of credit."	Diana Marculescu	NA	NA	NA	NA
18499	Internship	None	Electrical & Computer Engineering	"The Department of Electrical and Computer Engineering at Carnegie Mellon considers experiential learning opportunities important educational options for its undergraduate students.  One such option is an internship, normally completed during the summer.  Students do not need to officially register for an internship unless they want it listed on their official transcripts.  ECE students interested in registering their internship for course credit on their transcript may request to be enrolled in this course.  The ECE Undergraduate Office will add the course to the students schedule, and the student will be assessed tuition for 3 units.  This process should be used by international students interested in Curricular Practical Training (CPT) or by any other engineering undergraduate wishing to have their internship experience reflected on their official University transcript.     International students should also be authorized by the Office of International Education (OIE). More information regarding CPT is available on OIEs website."	Diana Marculescu	NA	NA	NA	NA
18980	M.S. Graduate Project	None	Electrical & Computer Engineering	None	Diana Marculescu	NA	NA	NA	NA
18990	Reading and Research	None	Electrical & Computer Engineering	None	Diana Marculescu	NA	NA	NA	NA
19797	Reading and Research: Project Research	None	Engineering & Public Policy	None	Deanna Matthews<>H Scott Matthews	NA	NA	NA	NA
19798	Reading and Research: Thesis Research	None	Engineering & Public Policy	Thesis research	Deanna Matthews<>H Scott Matthews	NA	NA	NA	NA
21120	Differential and Integral Calculus	10	Mathematical Sciences	None	Andrew Zucker	1<>2<>3<>4<>5	1030	1150	GHC 4211
21122	Integration and Approximation	10	Mathematical Sciences	"Integration by trigonometric substitution and partial fractions; arclength; improper integrals; Simpsons and Trapezoidal Rules for numerical integration; separable differential equations, Newtons method, Eulers method, Taylors Theorem including a discussion of the remainder, sequences, series, power series. Parametric curves, polar coordinates, vectors, dot product. 3 hrs lec., 2 hrs. rec."	Timothy Flaherty	1<>2<>3<>4<>5	1030	1150	WEH 5302
21127	Concepts of Mathematics	10	Mathematical Sciences	"This course introduces the basic concepts, ideas and tools involved in doing mathematics. As such, its main focus is on presenting informal logic, and the methods of mathematical proof. These subjects are closely related to the application of mathematics in many areas, particularly computer science. Topics discussed include a basic introduction to elementary number theory, induction, the algebra of sets, relations, equivalence relations, congruences, partitions, and functions, including injections, surjections, and bijections.  A basic introduction to the real numbers, rational and irrational numbers.  Supremum and infimum of a set.  3 hrs. lec., 2 hrs. rec."	Jing Zhang	1<>2<>3<>4<>5	900	1020	PH A18C
21259	Calculus in Three Dimensions	9	Mathematical Sciences	"Vectors, lines, planes, quadratic surfaces, polar, cylindrical and spherical coordinates, partial derivatives, directional derivatives, gradient, divergence, curl, chain rule, maximum-minimum problems, multiple integrals, parametric surfaces and curves, line integrals, surface integrals, Green-Gauss theorems. 3 hrs. lec., 1 hr. rec."	Devi Borg	1<>2<>3<>4<>5	900	1020	SH 214
21599	Undergraduate Reading and Research	None	Mathematical Sciences	Individual reading courses or projects in mathematics and its applications. Prerequisites and units to be negotiated with individual instructors.	Instructor TBA	NA	NA	NA	NA
24390	Mechanical Engineering Co-op	None	Mechanical Engineering	"The Department of Mechanical Engineering at Carnegie Mellon considers practical learning opportunities important educational options for its undergraduate students.  One such option is cooperative education, which provides a student with an extended work experience with a company or government institution.    To participate, students must possess at least junior status and have an overall grade point average of 3.0 or above.  Students must complete a Co-Op Approval Form and submit it for approval.  If the application is approved, the course will be added to the students schedule and the student will be assessed tuition for 0 units for each semester that the student participates. All co-ops must be approximately 5-8 months in uninterrupted length. Upon completion of the co-op experience, students must submit a 1-2 page report of their work experience, and a 1-2 page evaluation from the company supervisor to the ME Undergraduate Education Committee.  If the reports are approved, a P grade will be assigned.  International students should contact their academic advisor for additional information.   Prerequisite:  Special permission required"	Instructor TBA	NA	NA	NA	NA
24391	Mechanical Engineering Project	None	Mechanical Engineering	"Practice in the organization, planning, and execution of appropriate engineering projects. These investigations may be assigned on an individual or a team basis and in most cases will involve experimental work.  9 hrs. lab."	Chris Hertz	NA	NA	NA	NA
24392	Mechancial Engineering Project	None	Mechanical Engineering	"Practice in the organization, planning, and execution of appropriate engineering projects. These investigations may be assigned on an individual or a team basis and in most cases will involve experimental work.  9 hrs. lab."	Chris Hertz	NA	NA	NA	NA
24491	Department Research Honors	None	Mechanical Engineering	"This course is designed to give students increased exposure to open-ended problems and research type projects. It involves doing a project on a research or design topic and writing a thesis describing that project. The project would be conducted under the supervision of a mechanical engineering faculty member (the advisor), and must be approved by the advisor before inception. This course can be taken at any time after the Junior year and before graduation which includes the summer after the Junior year. Completion of 18 units of this course with a grade of B or better is a partial fulfillment of the requirements for Departmental Research Honors."	Instructor TBA	NA	NA	NA	NA
24492	Department Research Honors	None	Mechanical Engineering	"This course is designed to give students increased exposure to open-ended problems and research type projects. It involves doing a project on a research or design topic and writing a thesis describing that project. The project would be conducted under the supervision of a mechanical engineering faculty member (the advisor), and must be approved by the advisor before inception. This course can be taken at any time after the Junior year and before graduation which includes the summer after the Junior year. Completion of 18 units of this course with a grade of B or better is a partial fulfillment of the requirements for Departmental Research Honors."	Instructor TBA	NA	NA	NA	NA
33115	Physics for Future Presidents	9	Physics	"Countless topics of social and political importance are intimately related to science in general and physics in particular. Examples include energy production, global warming, radioactivity, terrorism, and space travel. This course aims to provide key bits of knowledge based on which such issues can be discussed in a meaningful way, i.e., on the level of arguments and not just vague beliefs. We will cover an unusually wide range of topics, including energy, heat, gravity, atoms, radioactivity, chain reactions, electricity, magnetism, waves, light, weather, and climate. No calculus or algebra will be required. The course is open for all students at CMU."	Kunal Ghosh	1<>2<>3<>4<>5	1500	1620	WEH 4709
33124	Introduction to Astronomy	9	Physics	None	Hael Collins	1<>2<>3<>4<>5	1330	1450	WEH 5302
33141	Physics I for Engineering Students	12	Physics	"This is a first semester, calculus-based introductory physics course. Basic principles of mechanics and thermodynamics are developed. Topics include vectors, displacement, velocity, acceleration, force, equilibrium, mass, Newtons laws, gravitation, work, energy, momentum, impulse, torque and angular momentum, temperature, heat, equations of state, thermodynamic processes, heat engines, refrigerators, first and second laws of thermodynamics, and the kinetic theory of gases."	Kunal Ghosh	1<>2<>3<>4<>5	1230	250	WEH 4709
33142	Physics II for Engineering and Physics Students	12	Physics	"This is the second half of a two-semester calculus-based introductory physics sequence for engineering and physics students. Two fifths of the course covers electricity, including electrostatics and electric fields, Gauss law, electric potential, and simple circuits. Two fifths cover magnetism, including magnetic forces, magnetic fields, induction and electromagnetic radiation. One fifth of the course covers mechanical waves (including standing and traveling waves, superposition, and beats) and electromagnetic waves (including mode of propagation, speed, and other properties)."	George Klein	1<>2<>3<>4<>5	930	1150	DH A301D
33451	Senior Research	None	Physics	"Open to all senior physics majors. May include research done in a research lab, extending the capabilities of a teaching lab, or a theoretical or computational physics project. The student experiences the less structured atmosphere of a research program where there is much room for independent initiative. Modern Physics Laboratory, 33-340, should precede this course, though it is not required. A list of research projects is available. The student must contact a faculty member and/or the Assistant Head for the Undergraduate Affairs before registering so that student project pairings can be set. Reports on results are required at end of semester."	Kunal Ghosh	NA	NA	NA	NA
33499	Supervised Reading	None	Physics	The student explores a certain area of advanced physics under the supervision of a faculty member. The student must contact a faculty member and the Assistant Head for Undergraduate Affairs before registering.	Kunal Ghosh	NA	NA	NA	NA
33997	Graduate Laboratory	None	Physics	None	Manfred Paulini	NA	NA	NA	NA
36201	Statistical Reasoning and Practice	9	Statistics	"This course will introduce students to the basic concepts, logic, and  issues involved in statistical reasoning, as well as basic statistical  methods used to analyze data and evaluate studies.  The major topics  to be covered include methods for exploratory data analysis, an  introduction to research methods, elementary probability, and methods  for statistical inference.  The objectives of this course are to help  students develop a critical approach to the evaluation of study  designs, data and results, and to develop skills in the application of  basic statistical methods in empirical research.  An important feature  of the course will be the use of the computer to facilitate the  understanding of important statistical ideas and for the  implementation of data analysis. In addition to three lectures a week,  students will attend a computer lab once a week. Examples will be  drawn from areas of applications of particular interest to HSS  students. Not open to students who have received credit for  36-207/70-207, 36-220, 36-225, 36-625, or 36-247."	Gordon Weinberg	1<>2<>3<>4<>5	1030	1150	PH A18C
36208	Regression Analysis	9	Statistics	None	Erica Vansant	1<>2<>3<>4<>5	900	1020	PH 226B
36226	Introduction to Statistical Inference	9	Statistics	None	Purvasha Chakravarti	1<>2<>3<>4<>5	1030	1150	DH A302
36309	Experimental Design for Behavioral and Social Sciences	9	Statistics	None	Amanda Sue Luby	1<>2<>3<>5	1030	1150	SH 214
39499	Summer Curricular Practical Training	3	CIT Interdisciplinary	"The college of engineering at Carnegie Mellon considers experiential learning opportunities important educational options for its undergraduate students. One such option is an internship, normally completed during the summer. Students do not need to officially register for an internship unless they want it listed on their official transcripts. CIT students interested in registering their internship for course credit on their transcript may enroll in this course. To do so, students must complete a CIT Internship form (located in Scaife Hall 110) and submit for approval. The CIT Undergraduate Studies Office will add the course to the students schedule, and the student will be assessed tuition for 3 units. Upon completion of the internship, students must submit a 1-2 page report of their work experience, and a 1-2 page evaluation from the company supervisor to the CIT Undergraduate Office. After the reports has been reviewed and approved, a P grade will be assigned. This process should be used by international students interested in Curricular Practical Training (CPT) or by any other engineering undergraduate wishing to have their internship experience reflected on their official University transcript. International students should also be authorized by the Office of International Education (OIE). More information regarding CPT is available on OIEs website."	Instructor TBA	NA	NA	NA	NA
39646	Independent Study Interaction Design Studio	None	CIT Interdisciplinary	None	Daniel Siewiorek	NA	NA	NA	NA
47900	Tepper PhD	None	Tepper School of Business	None	Instructor TBA	NA	NA	NA	NA
47995	Graduate Reading & Research	None	Tepper School of Business	None	Instructor TBA	NA	NA	NA	NA
47998	Tepper PhD Internship	None	Tepper School of Business	"This course is for Tepper PhD students only, to take external internships for credit."	Instructor TBA	NA	NA	NA	NA
48001	Architecture Elective	9	Architecture	None	Instructor TBA	NA	NA	NA	NA
48731	Sustainable Design Synthesis Prep	12	Architecture	"This is the preparatory course for the synthesis project course in the  Master of Science in Sustainable Design (MSSD) program. Students will build  upon the Research Models and Methods class to develop an individual project  proposal in an area of their interest related to sustainable design. The  students will attend bi-weekly meetings with the instructor and will submit  a formal research project proposal at the conclusion of the semester  including an abstract, a research plan, a schedule, an annotated  bibliography and proposed deliverables.  Prerequisites: Fall Coursework as per curriculum."	Instructor TBA	NA	NA	NA	NA
51260	Design Fundamentals	9	Design	None	Matthew Beale<>Dylan Vitone<>Wayne Chung<>Stacie Rohrbach	1<>2<>3<>4	1330	1550	MM 212
51399	Junior Independent Study	None	Design	Guidelines for independent study in the Design office.  Proposals must be approved by faculty before registration.	Instructor TBA	NA	NA	NA	NA
51470	Design Practicum	3	Design	"This course provides 3 units of pass/fail credit for students participating in a design internship.  The student must be registered for this course during the internship, in order to earn the credit.  In the summer semester, the course must be paid for as an additional course, as summer courses are not part of the normal fall/spring academic year.    At the end of the term, the students supervisor must email the course coordinator with a brief statement describing the students activities, and an evaluation of the students performance.  Students are required to submit a statement, reflecting on insights gained from the internship experience. Upon receipt of both statements, the course coordinator will assign a grade of either P or N, depending on the outcome."	Melissa Cicozi	NA	NA	NA	NA
51799	Graduate Independent  Study	None	Design	Students must submit a proposal to their selected faculty advisor.	Instructor TBA	NA	NA	NA	NA
54006	Independent Study	None	Drama	None	Instructor TBA	NA	NA	NA	NA
54495	Internship	None	Drama	None	Instructor TBA	NA	NA	NA	NA
54609	Independent Study in Dramaturgy	None	Drama	None	Instructor TBA	NA	NA	NA	NA
54828	Independent Study in Vocal Alexander Research	None	Drama	None	Instructor TBA	NA	NA	NA	NA
57341	Sound Recording Workshop	9	Music	None	Riccardo Schulz<>Thomas Sullivan	1<>3<>5	1330	1450	HH B103
57342	Sound Recording Workshop	6	Music	None	Riccardo Schulz	1<>3	1830	1950	CFA A6
